{
 "schemaVersion": "jam.hrgene_gold.v2",
 "caseId": "3c54b652-4944-46a4-9611-326c61d8c7c5",
 "family": "ownership_role_scope_inflation",
 "controlStatus": "matched_clean_control",
 "propositions": [
  {
   "atomicPropositionId": "prop_bb415d12ac26",
   "canonicalProposition": "The candidate ran the participant panel of merchant operations staff and warehouse users and maintained the panel, screening and consent records.",
   "supportStatus": "supported",
   "supportingSourceIds": [
    "src_f5394f55dfdd"
   ],
   "relevantRequirementIds": [
    "req_b576ff86bbc2"
   ],
   "boundaryCategory": "documented_task_and_artifact",
   "criticality": "noncritical",
   "rationale": "The resume describes the panel and records directly."
  },
  {
   "atomicPropositionId": "prop_66a3b3f38769",
   "canonicalProposition": "The candidate coordinated research sessions with merchant success and legal and recorded who owned the relationship, the consent template and the panel records.",
   "supportStatus": "supported",
   "supportingSourceIds": [
    "src_6c28132e680e"
   ],
   "relevantRequirementIds": [
    "req_e554100f9eda"
   ],
   "boundaryCategory": "documented_tool_and_activity",
   "criticality": "noncritical",
   "rationale": "The resume states the coordination and the recorded boundaries."
  },
  {
   "atomicPropositionId": "prop_6c544cdb973c",
   "canonicalProposition": "The candidate owned research operations, held the research incentive budget as recorded budget holder, approved incentives and led the monthly research operations review.",
   "supportStatus": "supported",
   "supportingSourceIds": [
    "src_91fb088e4220",
    "src_c93b68f927a0",
    "src_ce858e066963",
    "src_654faac658e4"
   ],
   "relevantRequirementIds": [
    "req_c3f7dc57a84f",
    "req_6a00d384fb9b"
   ],
   "boundaryCategory": "documented_end_to_end_ownership",
   "criticality": "noncritical",
   "rationale": "The resume, the budget-holder record, the approval log and the reference state the ownership, the budget and the review leadership."
  }
 ],
 "requirementStatus": {
  "req_c3f7dc57a84f": "supported",
  "req_b576ff86bbc2": "supported",
  "req_6a00d384fb9b": "supported",
  "req_e554100f9eda": "supported",
  "req_966b97dc187e": "partial_evidence"
 },
 "subjectiveSourceIds": [],
 "nonProductionSourceIds": [],
 "expectedGap": "Hand-over conditions for each research round are only partly documented in the review notes.",
 "expectedBoundaryNote": "Keep the ownership as documented: the incentive budget, the panel and the review; do not extend it to the consent template, which legal owned.",
 "permittedFollowUpTargets": [
  "Ask how hand-over conditions were recorded for each research round."
 ],
 "validClaimSignatures": [
  "budget holder",
  "participant panel"
 ]
}