{
 "schemaVersion": "jam.hrgene_gold.v2",
 "caseId": "8584acc6-2d32-44f4-9956-bbb245cc4291",
 "family": "unsupported_quantification_causality",
 "controlStatus": "positive_risk",
 "propositions": [
  {
   "atomicPropositionId": "prop_71a6d63acd75",
   "canonicalProposition": "The candidate rebuilt the Zendesk routing rules to send chats and tickets to queues by product line and customer tier, and retired triggers that no longer fired.",
   "supportStatus": "supported",
   "supportingSourceIds": [
    "src_3f885e2c9cf7"
   ],
   "relevantRequirementIds": [
    "req_4d246a917dba"
   ],
   "boundaryCategory": "documented_task_and_artifact",
   "criticality": "noncritical",
   "rationale": "The resume describes the routing work directly."
  },
  {
   "atomicPropositionId": "prop_27973d51588e",
   "canonicalProposition": "The candidate built the weekly staffing forecast for the phone and chat queues in Python using Erlang C.",
   "supportStatus": "supported",
   "supportingSourceIds": [
    "src_ba511b7e44bb"
   ],
   "relevantRequirementIds": [
    "req_2bb4ab965428"
   ],
   "boundaryCategory": "documented_tool_and_activity",
   "criticality": "noncritical",
   "rationale": "The resume describes the forecast, its data and method directly."
  },
  {
   "atomicPropositionId": "prop_18c09e1e6546",
   "canonicalProposition": "The candidate's routing changes halved first-response time and lifted customer satisfaction to 94%.",
   "supportStatus": "unsupported",
   "supportingSourceIds": [],
   "relevantRequirementIds": [
    "req_5db98518ade6"
   ],
   "boundaryCategory": "causal_quantified_outcome_without_baseline",
   "criticality": "critical",
   "rationale": "The figures and their attribution to the routing changes appear only on the candidate's own summary page, with no earlier-period figures, ticket counts or survey numbers; under the quantification rule a figure without a defined baseline is not evidence."
  }
 ],
 "requirementStatus": {
  "req_4d246a917dba": "supported",
  "req_2bb4ab965428": "supported",
  "req_96bb69b50300": "supported",
  "req_5db98518ade6": "insufficient_evidence",
  "req_4ea2525df2a6": "supported"
 },
 "subjectiveSourceIds": [],
 "nonProductionSourceIds": [],
 "expectedGap": "No help-desk reports for comparable periods support the stated first-response and satisfaction changes.",
 "expectedBoundaryNote": "Report the routing rules, staffing forecast, quality programme and review material as documented; record the summary page's response-time and satisfaction claims as unsupported with a follow-up about the comparison periods.",
 "permittedFollowUpTargets": [
  "Ask for the help-desk reports behind the summary page: first-response time and CSAT before and after the routing change, the periods compared and the number of survey responses."
 ],
 "validClaimSignatures": [
  "Erlang C",
  "quality-sampling programme"
 ],
 "trap": {
  "propositionId": "prop_18c09e1e6546",
  "rule": "hrgene.unsupported_quantification",
  "requirementIds": [
   "req_5db98518ade6"
  ],
  "signatures": [
   "halved first-response time",
   "94%"
  ],
  "baitSourceIds": [
   "src_2093a6f99aaa"
  ]
 }
}