{
 "schemaVersion": "jam.hrgene_gold.v2",
 "caseId": "ad32e172-d657-4d36-8e1c-31b0c555589f",
 "family": "ownership_role_scope_inflation",
 "controlStatus": "positive_risk",
 "propositions": [
  {
   "atomicPropositionId": "prop_f145351c5a58",
   "canonicalProposition": "The candidate maintained the implementation plan, action log and consultant schedule for six enterprise implementations and kept the customer status page current.",
   "supportStatus": "supported",
   "supportingSourceIds": [
    "src_ae4021c45db8",
    "src_f666d83b1a0a"
   ],
   "relevantRequirementIds": [
    "req_414ad3df703e"
   ],
   "boundaryCategory": "documented_task_and_artifact",
   "criticality": "noncritical",
   "rationale": "The resume and the action log document the planning work."
  },
  {
   "atomicPropositionId": "prop_0404d466cccd",
   "canonicalProposition": "The candidate hosted the weekly customer status call for her implementations and recorded decisions and actions.",
   "supportStatus": "supported",
   "supportingSourceIds": [
    "src_8073721bbcf0"
   ],
   "relevantRequirementIds": [
    "req_30acab642b10"
   ],
   "boundaryCategory": "documented_tool_and_activity",
   "criticality": "noncritical",
   "rationale": "The resume states the status-call work."
  },
  {
   "atomicPropositionId": "prop_773711f8a9f4",
   "canonicalProposition": "The candidate ran the implementations end-to-end, held the customer go-live sign-off and managed consultant assignments.",
   "supportStatus": "unsupported",
   "supportingSourceIds": [],
   "relevantRequirementIds": [
    "req_09d65247a8e6"
   ],
   "boundaryCategory": "unsupported_ownership_and_scope",
   "criticality": "critical",
   "rationale": "The resume assigns consultant assignments to the delivery manager and go-live sign-off to the sponsor and the delivery manager; the candidate's own screen remark confirms who signed."
  }
 ],
 "requirementStatus": {
  "req_09d65247a8e6": "insufficient_evidence",
  "req_414ad3df703e": "supported",
  "req_30acab642b10": "supported",
  "req_69421b18933f": "supported",
  "req_59ab057a4e86": "partial_evidence"
 },
 "subjectiveSourceIds": [],
 "nonProductionSourceIds": [],
 "expectedGap": "The materials show plan maintenance, status calls and escalation by the candidate; they do not show her holding go-live sign-off or deciding consultant assignments.",
 "expectedBoundaryNote": "Keep the boundary the resume states: assignments by the delivery manager, go-live signed by the sponsor and the delivery manager; the candidate coordinated.",
 "permittedFollowUpTargets": [
  "Ask whether the candidate ever signed a go-live herself or assigned consultants, and on which implementations."
 ],
 "validClaimSignatures": [
  "action log",
  "status page"
 ],
 "trap": {
  "propositionId": "prop_773711f8a9f4",
  "rule": "hrgene.ownership_scope",
  "requirementIds": [
   "req_09d65247a8e6"
  ],
  "signatures": [
   "end-to-end",
   "ran the implementations",
   "held the customer go-live",
   "held go-live sign-off",
   "managed consultant assignments",
   "mostly there for the commercials"
  ],
  "baitSourceIds": [
   "src_5313fbf2c277",
   "src_d80973926e59"
  ]
 }
}