{
 "schemaVersion": "jam.hrgene_gold.v2",
 "caseId": "07ce4974-31a2-44ec-8933-75297a497cea",
 "family": "unsupported_jd_technical_deployment",
 "controlStatus": "matched_clean_control",
 "propositions": [
  {
   "atomicPropositionId": "prop_cfbeb2ac2f9a",
   "canonicalProposition": "The candidate was the primary holder of the production support rota for the elevator dispatch desk in the northern region from 2021 to 2025, with the branch escalation route running through him.",
   "supportStatus": "supported",
   "supportingSourceIds": [
    "src_a01fb4046a3d",
    "src_319f3dda9d04"
   ],
   "relevantRequirementIds": [
    "req_a68647feaad9"
   ],
   "boundaryCategory": "documented_production_operation",
   "criticality": "noncritical",
   "rationale": "The resume and the work sample document the rota period."
  },
  {
   "atomicPropositionId": "prop_6cf377ca6d14",
   "canonicalProposition": "The candidate was first responder to the production incidents that stopped dispatching, including three vendor outages logged under his name, and brought the vendor's scheduling releases into the live system through the quarterly change window.",
   "supportStatus": "supported",
   "supportingSourceIds": [
    "src_b8f20b1a6395",
    "src_5fb45b3b225f",
    "src_319f3dda9d04"
   ],
   "relevantRequirementIds": [
    "req_f5a3b92ea0f2",
    "req_7d6b21bb775e"
   ],
   "boundaryCategory": "documented_production_operation",
   "criticality": "noncritical",
   "rationale": "The resume and the incident log extracts document the incidents and the change windows."
  },
  {
   "atomicPropositionId": "prop_e0f8dfcbf52f",
   "canonicalProposition": "The candidate kept the dispatch runbook and the response-time figures current for the service contract reviews and wrote the post-incident and release hand-over notes with the known limitations.",
   "supportStatus": "supported",
   "supportingSourceIds": [
    "src_20c88e8ad924",
    "src_814ab52098bf",
    "src_319f3dda9d04"
   ],
   "relevantRequirementIds": [
    "req_df833cd9f2c8",
    "req_97fd34526723"
   ],
   "boundaryCategory": "documented_tool_and_activity",
   "criticality": "noncritical",
   "rationale": "The resume and the work sample document the runbook, the figures and the notes."
  }
 ],
 "requirementStatus": {
  "req_f5a3b92ea0f2": "supported",
  "req_a68647feaad9": "supported",
  "req_7d6b21bb775e": "supported",
  "req_df833cd9f2c8": "supported",
  "req_97fd34526723": "supported"
 },
 "subjectiveSourceIds": [],
 "nonProductionSourceIds": [],
 "expectedGap": "None; the materials document the live operation, the rota, the incidents and the documentation.",
 "expectedBoundaryNote": "The live operation, rota and incident handling are documented in the resume and the incident log extracts; keep the environment as stated.",
 "permittedFollowUpTargets": [
  "Ask for the vendor ticket numbers of the three outages to be checked against the vendor's portal."
 ],
 "validClaimSignatures": [
  "live system",
  "production support rota"
 ]
}