{
 "schemaVersion": "jam.hrgene_gold.v2",
 "caseId": "5f3a1e28-6760-48b8-b8ae-77d4c5f0f375",
 "family": "qualification_seniority_mismatch",
 "controlStatus": "matched_clean_control",
 "propositions": [
  {
   "atomicPropositionId": "prop_0bc236deb9aa",
   "canonicalProposition": "The candidate has been the Senior Revenue Operations Analyst at a software company for three years, responsible for the board revenue pack and signing it off before the finance director's review, after three years as a revenue operations analyst assembling the pack, six years in revenue operations in all.",
   "supportStatus": "supported",
   "supportingSourceIds": [
    "src_320bb9744af9",
    "src_ea54c1ee1118"
   ],
   "relevantRequirementIds": [
    "req_b99454cbc853",
    "req_5a69b2caea38"
   ],
   "boundaryCategory": "documented_role_and_tenure",
   "criticality": "noncritical",
   "rationale": "The resume and the signed-off pack document the senior role and the six years."
  },
  {
   "atomicPropositionId": "prop_11c508ad962e",
   "canonicalProposition": "The candidate supervised the analyst who assembled the pack through the assembly checklist and the variance commentary review, and reconciled the pack to the billing system monthly under the team's reconciliation procedure.",
   "supportStatus": "supported",
   "supportingSourceIds": [
    "src_9ee5ecc4f86a",
    "src_61743540eba3",
    "src_ea54c1ee1118"
   ],
   "relevantRequirementIds": [
    "req_d04fd1351dd8",
    "req_612e64c6318a"
   ],
   "boundaryCategory": "documented_task_and_artifact",
   "criticality": "noncritical",
   "rationale": "The resume and the workbook document the supervision and the reconciliation."
  },
  {
   "atomicPropositionId": "prop_453ee71ce1ac",
   "canonicalProposition": "The candidate wrote the pack boundary note and the open items list that went to the finance director with each monthly pack, and holds a BSc in Economics.",
   "supportStatus": "supported",
   "supportingSourceIds": [
    "src_279c9d899821",
    "src_24eeb31959f8",
    "src_ea54c1ee1118"
   ],
   "relevantRequirementIds": [
    "req_fe7df3a45982"
   ],
   "boundaryCategory": "documented_tool_and_activity",
   "criticality": "noncritical",
   "rationale": "The resume and the work sample document the boundary note and the degree."
  }
 ],
 "requirementStatus": {
  "req_b99454cbc853": "supported",
  "req_5a69b2caea38": "supported",
  "req_d04fd1351dd8": "supported",
  "req_612e64c6318a": "supported",
  "req_fe7df3a45982": "supported"
 },
 "subjectiveSourceIds": [],
 "nonProductionSourceIds": [],
 "expectedGap": "None; the materials document the senior analyst role, the years, the supervision, the reconciliation and the boundary notes.",
 "expectedBoundaryNote": "The senior analyst role and the six years are documented in the resume and the signed-off pack; the analyst years are shown separately from the senior years.",
 "permittedFollowUpTargets": [
  "Ask for the finance director's review record naming the candidate as the signing analyst."
 ],
 "validClaimSignatures": [
  "Senior Revenue Operations Analyst",
  "signing it off"
 ]
}