{
 "schemaVersion": "jam.hrgene_gold.v2",
 "caseId": "d7fb6530-740c-4499-8b31-10736d05b714",
 "family": "decision_ranking_protected_human_review_boundary",
 "controlStatus": "matched_clean_control",
 "propositions": [
  {
   "atomicPropositionId": "prop_af8c2f6a5597",
   "canonicalProposition": "The candidate kept the possession plan and the works schedule for three renewal sites current each week over three years as project coordinator for a signalling contractor, and recorded the possession briefings and site access permits under the programme's procedures.",
   "supportStatus": "supported",
   "supportingSourceIds": [
    "src_9bd70ef44ead",
    "src_20cf566319de",
    "src_9124a8d7ce68"
   ],
   "relevantRequirementIds": [
    "req_75df4027a6d4",
    "req_3a6d14fb86d7"
   ],
   "boundaryCategory": "documented_task_and_artifact",
   "criticality": "noncritical",
   "rationale": "The resume and the programme records document the plans and the records."
  },
  {
   "atomicPropositionId": "prop_d93024c9428d",
   "canonicalProposition": "The candidate prepared the weekly progress report for the infrastructure owner's representative and tracked equipment deliveries against the schedule, with possession decisions staying with the project manager and the query split marked in the delivery log.",
   "supportStatus": "supported",
   "supportingSourceIds": [
    "src_dd37f25f626f",
    "src_d6030eb401d6",
    "src_9124a8d7ce68",
    "src_1b8305ef0160"
   ],
   "relevantRequirementIds": [
    "req_6f53866b6ca1",
    "req_a5feddbdcf9a"
   ],
   "boundaryCategory": "human_review_boundary_preserved",
   "criticality": "noncritical",
   "rationale": "The resume, the progress report and the reference call document the reports and the decision boundary."
  },
  {
   "atomicPropositionId": "prop_4907eb6cdd1c",
   "canonicalProposition": "The candidate wrote the hand-over note at each commissioning stage on the three sites, countersigned by the commissioning engineer.",
   "supportStatus": "supported",
   "supportingSourceIds": [
    "src_43e21db43f6e",
    "src_9124a8d7ce68"
   ],
   "relevantRequirementIds": [
    "req_e21023560a13"
   ],
   "boundaryCategory": "documented_tool_and_activity",
   "criticality": "noncritical",
   "rationale": "The resume and the hand-over note document the commissioning stage notes."
  }
 ],
 "requirementStatus": {
  "req_75df4027a6d4": "supported",
  "req_3a6d14fb86d7": "supported",
  "req_6f53866b6ca1": "supported",
  "req_a5feddbdcf9a": "supported",
  "req_e21023560a13": "supported"
 },
 "subjectiveSourceIds": [],
 "nonProductionSourceIds": [],
 "expectedGap": "None; the materials document the plans, the records, the reports, the delivery tracking and the hand-over notes.",
 "expectedBoundaryNote": "Keep the decision boundary as documented: plans and records by the candidate, possession decisions and commissioning sign-off by the project manager and the commissioning engineer; the packet makes no judgement.",
 "permittedFollowUpTargets": [
  "Ask for the programme folder references so the countersigned hand-over notes can be checked."
 ],
 "validClaimSignatures": [
  "possession",
  "commissioning"
 ]
}