{
 "schemaVersion": "jam.hrgene_gold.v2",
 "caseId": "20085c02-7db6-4afe-a6a2-236f7935e0b5",
 "family": "decision_ranking_protected_human_review_boundary",
 "controlStatus": "matched_clean_control",
 "propositions": [
  {
   "atomicPropositionId": "prop_2ca14ec9aeaa",
   "canonicalProposition": "The card-fraud model documented by the candidate passed independent validation in June 2024 under record MRV-2024-031 with no high-severity findings, as the head of model risk management confirmed in writing.",
   "supportStatus": "supported",
   "supportingSourceIds": [
    "src_0044fc2e5341",
    "src_bac1323328d8"
   ],
   "relevantRequirementIds": [
    "req_bfbfd6b85243"
   ],
   "boundaryCategory": "reference_confirmed_outcome_with_record",
   "criticality": "noncritical",
   "rationale": "The reference check records the written confirmation and the validation record; the resume describes the documentation the candidate prepared."
  },
  {
   "atomicPropositionId": "prop_db319a3555a3",
   "canonicalProposition": "The candidate built an XGBoost card-fraud model on 18 months of labelled transactions.",
   "supportStatus": "supported",
   "supportingSourceIds": [
    "src_e25de2be9c76"
   ],
   "relevantRequirementIds": [
    "req_27091ea69b08"
   ],
   "boundaryCategory": "documented_task_and_artifact",
   "criticality": "noncritical",
   "rationale": "The resume states the method, the data period and the features."
  },
  {
   "atomicPropositionId": "prop_4a2c95b33093",
   "canonicalProposition": "The candidate reported monthly alert precision and fraud value detected by rule and score band to the head of fraud operations.",
   "supportStatus": "supported",
   "supportingSourceIds": [
    "src_97d1280c6cf2",
    "src_e64c7b1bb8e7"
   ],
   "relevantRequirementIds": [
    "req_a022bb8c23f4"
   ],
   "boundaryCategory": "documented_task_and_artifact",
   "criticality": "noncritical",
   "rationale": "The resume describes the report and the work sample is one month's anonymised report."
  }
 ],
 "requirementStatus": {
  "req_27091ea69b08": "supported",
  "req_21a1097e6778": "supported",
  "req_0d6855d957e9": "partial_evidence",
  "req_a022bb8c23f4": "supported",
  "req_bfbfd6b85243": "supported"
 },
 "subjectiveSourceIds": [],
 "nonProductionSourceIds": [],
 "expectedGap": "The candidate explored device-fingerprint data with data engineering; device or behavioural features built into a model are not described.",
 "expectedBoundaryNote": "Keep the validation outcome with its record, the model build and the alert-quality reporting as documented; the packet lists evidence and gaps only.",
 "permittedFollowUpTargets": [
  "Ask which device or behavioural features the candidate designed and whether any went into a validated model."
 ],
 "validClaimSignatures": [
  "MRV-2024-031",
  "alert precision"
 ]
}