{
 "schemaVersion": "jam.hrgene_gold.v2",
 "caseId": "82f39ee3-1ecd-4a3c-84f0-116972ef840c",
 "family": "unsupported_quantification_causality",
 "controlStatus": "matched_clean_control",
 "propositions": [
  {
   "atomicPropositionId": "prop_d32fbdb1677b",
   "canonicalProposition": "At a fixed 0.5% alert rate, card-not-present fraud value detected rose from 61% (January to March 2023) to 74% (July to September 2023) after the retrained model went into use in May 2023, according to the memo obtained from the model risk office.",
   "supportStatus": "supported",
   "supportingSourceIds": [
    "src_717a31c2cf41",
    "src_2d8e22626e6e"
   ],
   "relevantRequirementIds": [
    "req_1ae1cf5b4085"
   ],
   "boundaryCategory": "quantified_result_with_defined_baseline",
   "criticality": "noncritical",
   "rationale": "The verification note records a memo obtained from the employer with a fixed alert rate and two defined periods; the resume describes the retraining."
  },
  {
   "atomicPropositionId": "prop_7d072597e271",
   "canonicalProposition": "The candidate retrained the gradient-boosted fraud model and recalibrated its alert thresholds with the fraud strategy managers at a 0.5% operating point.",
   "supportStatus": "supported",
   "supportingSourceIds": [
    "src_717a31c2cf41",
    "src_c68aa0c5c064"
   ],
   "relevantRequirementIds": [
    "req_b4bf21717cf3"
   ],
   "boundaryCategory": "documented_task_and_artifact",
   "criticality": "noncritical",
   "rationale": "The resume describes the retraining and the work sample records the operating point and sign-off."
  },
  {
   "atomicPropositionId": "prop_19f5fc3bdc48",
   "canonicalProposition": "The candidate reviewed 64 strategy rules and proposed retiring 17, of which the fraud strategy managers approved 15.",
   "supportStatus": "supported",
   "supportingSourceIds": [
    "src_63e5e4d76520"
   ],
   "relevantRequirementIds": [
    "req_6a59b1114604"
   ],
   "boundaryCategory": "documented_task_and_artifact",
   "criticality": "noncritical",
   "rationale": "The resume states the review and its outcome directly."
  }
 ],
 "requirementStatus": {
  "req_f98238095dee": "partial_evidence",
  "req_b4bf21717cf3": "supported",
  "req_1ae1cf5b4085": "supported",
  "req_6a59b1114604": "supported",
  "req_d4faa95e371b": "supported"
 },
 "subjectiveSourceIds": [],
 "nonProductionSourceIds": [],
 "expectedGap": "The training-set work covers confirmed third-party fraud and chargebacks; first-party fraud labelling is not described.",
 "expectedBoundaryNote": "Keep the detection result with its fixed alert rate, both periods and the employer-supplied memo, describing it as following the model change rather than as the candidate's sole result; keep the documented rule review.",
 "permittedFollowUpTargets": [
  "Ask whether the candidate has built labels for first-party fraud and how those cases were identified."
 ],
 "validClaimSignatures": [
  "from 61%",
  "threshold workshops",
  "64 strategy rules"
 ]
}