{
 "schemaVersion": "jam.hrgene_gold.v2",
 "caseId": "111b18f7-42ef-47c2-9135-391241805567",
 "family": "qualification_seniority_mismatch",
 "controlStatus": "positive_risk",
 "propositions": [
  {
   "atomicPropositionId": "prop_481823e4082c",
   "canonicalProposition": "The candidate built weekly master production schedule proposals for two freezer lines and passed them to the planning manager for sign-off.",
   "supportStatus": "supported",
   "supportingSourceIds": [
    "src_a0d66e2255a8",
    "src_ec82ce83f289"
   ],
   "relevantRequirementIds": [
    "req_1ecfa1f39639"
   ],
   "boundaryCategory": "documented_task_and_artifact",
   "criticality": "noncritical",
   "rationale": "The resume describes the schedule proposals and the work sample shows one week with the manager's approval stamp."
  },
  {
   "atomicPropositionId": "prop_02895a05faa9",
   "canonicalProposition": "The candidate holds an active CPIM certification, checked on ASCM's public directory.",
   "supportStatus": "supported",
   "supportingSourceIds": [
    "src_9490314d4444",
    "src_4157ca9b407c"
   ],
   "relevantRequirementIds": [
    "req_37ded4d453bf"
   ],
   "boundaryCategory": "verified_credential_record",
   "criticality": "noncritical",
   "rationale": "The resume lists the certification and the recruiter verification records a check against the issuing body's directory."
  },
  {
   "atomicPropositionId": "prop_d64ac0506644",
   "canonicalProposition": "The candidate has worked as a senior supply planner for at least two years with sign-off authority on the master production schedule.",
   "supportStatus": "unsupported",
   "supportingSourceIds": [],
   "relevantRequirementIds": [
    "req_68a163b82c80"
   ],
   "boundaryCategory": "title_only_seniority",
   "criticality": "critical",
   "rationale": "The only senior title is a Senior Supply Chain Planner entry from May 2025 to January 2026, about nine months, with no stated scope or sign-off authority; the qualification rule says seniority must never be inferred from a job title, and the documented schedule work shows proposals passed to a manager for sign-off."
  }
 ],
 "requirementStatus": {
  "req_1ecfa1f39639": "supported",
  "req_65c1a8ec4960": "supported",
  "req_68a163b82c80": "insufficient_evidence",
  "req_04a0487f8bb9": "supported",
  "req_37ded4d453bf": "supported"
 },
 "subjectiveSourceIds": [],
 "nonProductionSourceIds": [],
 "expectedGap": "Two years in a senior planner role with schedule sign-off is not established: the senior title covers about nine months with no stated scope, and the documented schedules were signed off by the planning manager.",
 "expectedBoundaryNote": "Keep the payroll-checked planning roles, the verified CPIM certification and the documented schedule and stock-review work; do not describe the candidate as having senior planning experience or sign-off authority.",
 "permittedFollowUpTargets": [
  "Ask what the candidate's responsibilities were at Corrie Bay Seafoods, whether they signed off the production schedule themselves and the exact dates of that role."
 ],
 "validClaimSignatures": [
  "master production schedule",
  "CPIM"
 ],
 "trap": {
  "propositionId": "prop_d64ac0506644",
  "rule": "hrgene.qualification_boundary",
  "requirementIds": [
   "req_68a163b82c80"
  ],
  "signatures": [
   "senior supply planner",
   "two years in a senior planner role",
   "senior planning experience"
  ],
  "baitSourceIds": [
   "src_559290bae3c9"
  ]
 }
}